{
  "$schema": "https://json-schema.org/draft/2020-12/schema",
  "$id": "https://open-links.dev/schema/links.schema.json",
  "title": "OpenLinks Links",
  "type": "object",
  "$defs": {
    "paymentRailType": {
      "type": "string",
      "enum": [
        "patreon",
        "kofi",
        "paypal",
        "cashapp",
        "stripe",
        "coinbase",
        "bitcoin",
        "lightning",
        "ethereum",
        "solana",
        "custom-crypto"
      ]
    },
    "paymentQrDisplayMode": {
      "type": "string",
      "enum": ["always", "toggle", "hidden"]
    },
    "paymentQrStyle": {
      "type": "string",
      "enum": ["square", "rounded", "dots"]
    },
    "paymentQrLogoMode": {
      "type": "string",
      "enum": ["rail-default", "custom", "none"]
    },
    "paymentQrBadgeMode": {
      "type": "string",
      "enum": ["auto", "custom", "none"]
    },
    "paymentQrBadgeItemType": {
      "type": "string",
      "enum": ["rail", "site", "asset"]
    },
    "paymentQrFullscreenMode": {
      "type": "string",
      "enum": ["enabled", "disabled"]
    },
    "paymentCardEffect": {
      "type": "string",
      "enum": ["particles", "lightning-particles", "glitter-particles"]
    },
    "paymentCardGlitterPalette": {
      "type": "string",
      "enum": ["gold", "ice"]
    },
    "paymentCardEffectsConfig": {
      "type": "object",
      "properties": {
        "enabled": { "type": "boolean" },
        "effects": {
          "type": "array",
          "minItems": 1,
          "uniqueItems": true,
          "items": { "$ref": "#/$defs/paymentCardEffect" }
        },
        "glitterPalette": { "$ref": "#/$defs/paymentCardGlitterPalette" },
        "bombasticity": {
          "type": "number",
          "minimum": 0,
          "maximum": 1
        },
        "custom": {
          "type": "object",
          "additionalProperties": true
        }
      },
      "additionalProperties": true
    },
    "paymentQrBadgeItem": {
      "type": "object",
      "required": ["type"],
      "properties": {
        "type": { "$ref": "#/$defs/paymentQrBadgeItemType" },
        "value": { "type": "string", "minLength": 1 }
      },
      "allOf": [
        {
          "if": {
            "properties": {
              "type": { "enum": ["site", "asset"] }
            }
          },
          "then": {
            "required": ["value"]
          }
        }
      ],
      "additionalProperties": true
    },
    "paymentQrBadgeConfig": {
      "type": "object",
      "properties": {
        "mode": { "$ref": "#/$defs/paymentQrBadgeMode" },
        "size": { "type": "number", "minimum": 0.05, "maximum": 0.5 },
        "items": {
          "type": "array",
          "minItems": 1,
          "maxItems": 2,
          "items": { "$ref": "#/$defs/paymentQrBadgeItem" }
        }
      },
      "allOf": [
        {
          "if": {
            "properties": {
              "mode": { "const": "custom" }
            }
          },
          "then": {
            "required": ["items"]
          }
        }
      ],
      "additionalProperties": true
    },
    "paymentQrConfig": {
      "type": "object",
      "properties": {
        "enabled": { "type": "boolean" },
        "fullscreen": { "$ref": "#/$defs/paymentQrFullscreenMode" },
        "style": { "$ref": "#/$defs/paymentQrStyle" },
        "foregroundColor": { "type": "string", "minLength": 1 },
        "backgroundColor": { "type": "string", "minLength": 1 },
        "logoMode": { "$ref": "#/$defs/paymentQrLogoMode" },
        "logoUrl": { "type": "string", "minLength": 1 },
        "logoSize": { "type": "number", "minimum": 0.05, "maximum": 0.5 },
        "badge": { "$ref": "#/$defs/paymentQrBadgeConfig" },
        "payload": { "type": "string", "minLength": 1 },
        "custom": {
          "type": "object",
          "additionalProperties": true
        }
      },
      "allOf": [
        {
          "if": {
            "required": ["logoMode"],
            "properties": {
              "logoMode": { "const": "custom" }
            }
          },
          "then": {
            "required": ["logoUrl"]
          }
        }
      ],
      "additionalProperties": true
    },
    "paymentAppLink": {
      "type": "object",
      "required": ["appId", "label", "url"],
      "properties": {
        "appId": { "type": "string", "minLength": 1 },
        "label": { "type": "string", "minLength": 1 },
        "url": { "type": "string", "format": "uri" },
        "custom": {
          "type": "object",
          "additionalProperties": true
        }
      },
      "additionalProperties": true
    },
    "paymentRail": {
      "type": "object",
      "required": ["id", "rail"],
      "properties": {
        "id": { "type": "string", "minLength": 1 },
        "rail": { "$ref": "#/$defs/paymentRailType" },
        "provider": { "type": "string", "minLength": 1 },
        "label": { "type": "string" },
        "enabled": { "type": "boolean" },
        "icon": { "type": "string" },
        "url": { "type": "string", "format": "uri" },
        "uri": { "type": "string", "minLength": 1 },
        "address": { "type": "string", "minLength": 1 },
        "scheme": { "type": "string", "minLength": 1 },
        "network": { "type": "string", "minLength": 1 },
        "amount": { "type": "string", "minLength": 1 },
        "message": { "type": "string", "minLength": 1 },
        "memo": { "type": "string", "minLength": 1 },
        "chainId": {
          "oneOf": [{ "type": "string", "minLength": 1 }, { "type": "number" }]
        },
        "references": {
          "type": "array",
          "items": {
            "type": "string",
            "minLength": 1
          }
        },
        "query": {
          "type": "object",
          "propertyNames": {
            "type": "string",
            "minLength": 1
          },
          "additionalProperties": {
            "type": "string",
            "minLength": 1
          }
        },
        "qr": { "$ref": "#/$defs/paymentQrConfig" },
        "appLinks": {
          "type": "array",
          "items": { "$ref": "#/$defs/paymentAppLink" }
        },
        "custom": {
          "type": "object",
          "additionalProperties": true
        }
      },
      "additionalProperties": true
    },
    "linkPaymentConfig": {
      "type": "object",
      "properties": {
        "qrDisplay": { "$ref": "#/$defs/paymentQrDisplayMode" },
        "primaryRailId": { "type": "string", "minLength": 1 },
        "effects": { "$ref": "#/$defs/paymentCardEffectsConfig" },
        "rails": {
          "type": "array",
          "minItems": 1,
          "items": { "$ref": "#/$defs/paymentRail" }
        },
        "custom": {
          "type": "object",
          "additionalProperties": true
        }
      },
      "additionalProperties": true
    },
    "linkReferralKind": {
      "type": "string",
      "enum": ["referral", "affiliate", "promo", "invite"]
    },
    "linkReferralCatalogId": {
      "type": "string",
      "pattern": "^[a-z0-9]+(?:-[a-z0-9]+)*$"
    },
    "linkReferralCatalogRef": {
      "type": "object",
      "properties": {
        "familyId": { "$ref": "#/$defs/linkReferralCatalogId" },
        "offerId": { "$ref": "#/$defs/linkReferralCatalogId" },
        "matcherId": { "$ref": "#/$defs/linkReferralCatalogId" }
      },
      "minProperties": 1,
      "additionalProperties": false
    },
    "linkReferralConfig": {
      "type": "object",
      "properties": {
        "kind": { "$ref": "#/$defs/linkReferralKind" },
        "catalogRef": { "$ref": "#/$defs/linkReferralCatalogRef" },
        "visitorBenefit": { "type": "string" },
        "ownerBenefit": { "type": "string" },
        "offerSummary": { "type": "string" },
        "termsSummary": { "type": "string" },
        "termsUrl": { "type": "string", "format": "uri" },
        "code": { "type": "string", "minLength": 1 },
        "custom": {
          "type": "object",
          "additionalProperties": true
        }
      },
      "additionalProperties": true
    },
    "facebookPageMetricsConfig": {
      "type": "object",
      "properties": {
        "enabled": { "type": "boolean" },
        "pageId": {
          "type": "string",
          "pattern": "^\\d{5,30}$"
        },
        "apiVersion": {
          "type": "string",
          "pattern": "^v\\d+\\.\\d+$"
        }
      },
      "allOf": [
        {
          "if": {
            "properties": {
              "enabled": { "const": true }
            },
            "required": ["enabled"]
          },
          "then": {
            "required": ["pageId"]
          }
        }
      ],
      "additionalProperties": false
    },
    "linkItem": {
      "type": "object",
      "required": ["id", "label", "type"],
      "properties": {
        "id": { "type": "string", "minLength": 1 },
        "label": { "type": "string", "minLength": 1 },
        "url": { "type": "string", "format": "uri" },
        "type": { "type": "string", "enum": ["simple", "rich", "payment"] },
        "icon": { "type": "string" },
        "description": { "type": "string" },
        "group": { "type": "string" },
        "order": { "type": "integer", "minimum": 0 },
        "enabled": { "type": "boolean" },
        "metadata": {
          "type": "object",
          "properties": {
            "title": { "type": "string" },
            "description": { "type": "string" },
            "profileDescription": { "type": "string" },
            "descriptionSource": {
              "type": "string",
              "enum": ["fetched", "manual"]
            },
            "image": { "type": "string", "format": "uri" },
            "ogImage": { "type": "string", "format": "uri" },
            "twitterImage": { "type": "string", "format": "uri" },
            "profileImage": { "type": "string", "minLength": 1 },
            "handle": { "type": "string" },
            "followersCount": { "type": "integer", "minimum": 0 },
            "followersCountRaw": { "type": "string", "minLength": 1 },
            "followingCount": { "type": "integer", "minimum": 0 },
            "followingCountRaw": { "type": "string", "minLength": 1 },
            "subscribersCount": { "type": "integer", "minimum": 0 },
            "subscribersCountRaw": { "type": "string", "minLength": 1 },
            "imageFit": {
              "type": "string",
              "enum": ["cover", "contain"]
            },
            "mobileImageLayout": {
              "type": "string",
              "enum": ["inline", "full-width"]
            },
            "sourceLabel": { "type": "string" },
            "sourceLabelVisible": { "type": "boolean" },
            "enrichmentStatus": {
              "type": "string",
              "enum": ["fetched", "partial", "failed", "skipped"]
            },
            "enrichmentReason": {
              "type": "string",
              "enum": [
                "metadata_complete",
                "metadata_partial",
                "metadata_missing",
                "fetch_failed",
                "public_cache",
                "authenticated_cache",
                "authenticated_cache_missing",
                "known_blocker",
                "enrichment_disabled"
              ]
            },
            "enrichedAt": { "type": "string", "format": "date-time" },
            "custom": {
              "type": "object",
              "additionalProperties": true
            }
          },
          "additionalProperties": true
        },
        "enrichment": {
          "type": "object",
          "properties": {
            "enabled": { "type": "boolean" },
            "profileSemantics": {
              "type": "string",
              "enum": ["auto", "profile", "non_profile"]
            },
            "allowKnownBlocker": { "type": "boolean" },
            "authenticatedExtractor": { "type": "string", "minLength": 1 },
            "authenticatedCacheKey": { "type": "string", "minLength": 1 },
            "facebookPageMetrics": { "$ref": "#/$defs/facebookPageMetricsConfig" },
            "sourceLabel": { "type": "string" },
            "sourceLabelVisible": { "type": "boolean" },
            "custom": {
              "type": "object",
              "additionalProperties": true
            }
          },
          "additionalProperties": true
        },
        "referral": { "$ref": "#/$defs/linkReferralConfig" },
        "payment": { "$ref": "#/$defs/linkPaymentConfig" },
        "custom": {
          "type": "object",
          "additionalProperties": true
        }
      },
      "allOf": [
        {
          "if": {
            "properties": {
              "type": {
                "enum": ["simple", "rich"]
              }
            },
            "required": ["type"]
          },
          "then": {
            "required": ["url"]
          }
        },
        {
          "if": {
            "properties": {
              "type": { "const": "payment" }
            },
            "required": ["type"]
          },
          "then": {
            "anyOf": [
              {
                "required": ["url"]
              },
              {
                "required": ["payment"],
                "properties": {
                  "payment": {
                    "required": ["rails"]
                  }
                }
              }
            ]
          }
        }
      ],
      "additionalProperties": true
    }
  },
  "required": ["links"],
  "properties": {
    "links": {
      "type": "array",
      "minItems": 1,
      "items": { "$ref": "#/$defs/linkItem" }
    },
    "groups": {
      "type": "array",
      "items": {
        "type": "object",
        "required": ["id", "label"],
        "properties": {
          "id": { "type": "string", "minLength": 1 },
          "label": { "type": "string", "minLength": 1 },
          "order": { "type": "integer", "minimum": 0 }
        },
        "additionalProperties": true
      }
    },
    "order": {
      "type": "array",
      "items": {
        "type": "string",
        "minLength": 1
      }
    },
    "custom": {
      "type": "object",
      "additionalProperties": true
    }
  },
  "additionalProperties": true
}
