{
  "links": [
    {
      "id": "github",
      "label": "GitHub",
      "url": "https://github.com",
      "type": "simple",
      "group": "social",
      "order": 1,
      "enabled": true,
      "custom": {}
    },
    {
      "id": "linkedin",
      "label": "LinkedIn",
      "url": "https://linkedin.com",
      "type": "rich",
      "group": "work",
      "order": 1,
      "enabled": true,
      "metadata": {
        "title": "Professional profile"
      },
      "custom": {}
    },
    {
      "id": "portfolio",
      "label": "Portfolio",
      "url": "https://example.com/portfolio",
      "type": "simple",
      "group": "work",
      "order": 2,
      "enabled": true,
      "custom": {}
    },
    {
      "id": "cluborange-referral",
      "label": "Join Club Orange",
      "url": "https://app.cluborange.org/pryszkie",
      "type": "rich",
      "icon": "cluborange",
      "group": "work",
      "order": 3,
      "enabled": true,
      "enrichment": {
        "profileSemantics": "non_profile"
      },
      "referral": {
        "kind": "referral",
        "visitorBenefit": "Get 20% off your first year",
        "ownerBenefit": "Supports the project",
        "offerSummary": "Join Club Orange with a referral discount",
        "termsUrl": "https://www.cluborange.org/signup?referral=example"
      },
      "custom": {}
    },
    {
      "id": "support",
      "label": "Support",
      "type": "payment",
      "group": "support",
      "order": 1,
      "enabled": true,
      "payment": {
        "qrDisplay": "always",
        "primaryRailId": "btc",
        "rails": [
          {
            "id": "btc",
            "rail": "bitcoin",
            "address": "bc1qexampletestaddress3w6x34",
            "amount": "0.0005",
            "message": "Thanks for the support",
            "qr": {
              "style": "dots",
              "logoMode": "rail-default"
            }
          },
          {
            "id": "patreon",
            "rail": "patreon",
            "url": "https://patreon.com/example"
          }
        ]
      },
      "custom": {}
    }
  ],
  "groups": [
    {
      "id": "social",
      "label": "Social",
      "order": 1
    },
    {
      "id": "work",
      "label": "Work",
      "order": 2
    },
    {
      "id": "support",
      "label": "Support",
      "order": 3
    }
  ],
  "order": ["github", "linkedin", "portfolio", "cluborange-referral", "support"],
  "custom": {}
}
