{
  "links": [
    {
      "id": "primal",
      "label": "Primal",
      "url": "https://primal.net/peterryszkiewicz",
      "type": "rich",
      "icon": "primal",
      "description": "Nostr profile and notes",
      "group": "favorites",
      "order": 1,
      "enabled": true,
      "enrichment": {
        "enabled": true
      },
      "custom": {}
    },
    {
      "id": "github",
      "label": "GitHub",
      "url": "https://github.com/pRizz",
      "type": "rich",
      "icon": "github",
      "description": "Code, experiments, and open-source projects",
      "group": "favorites",
      "order": 2,
      "enabled": true,
      "enrichment": {
        "enabled": true
      },
      "custom": {}
    },
    {
      "id": "x",
      "label": "X",
      "url": "https://x.com/pryszkie",
      "type": "rich",
      "icon": "x",
      "description": "Short updates and project notes",
      "group": "favorites",
      "order": 3,
      "enabled": true,
      "enrichment": {
        "enabled": true
      },
      "custom": {}
    },
    {
      "id": "linkedin",
      "label": "LinkedIn",
      "url": "https://www.linkedin.com/in/peter-ryszkiewicz/",
      "type": "rich",
      "icon": "linkedin",
      "description": "Professional profile and recent work",
      "group": "work",
      "order": 4,
      "enabled": true,
      "enrichment": {
        "enabled": true,
        "authenticatedExtractor": "linkedin-auth-browser"
      },
      "custom": {}
    },
    {
      "id": "openlinks-home",
      "label": "OpenLinks",
      "url": "https://openlinks.us",
      "type": "simple",
      "icon": "github",
      "description": "Project homepage preview card with fallback defaults",
      "group": "work",
      "order": 5,
      "enabled": true,
      "custom": {}
    },
    {
      "id": "bright-builds-facebook",
      "label": "Bright Builds LLC",
      "url": "https://www.facebook.com/people/Bright-Builds-LLC/61588043858384/",
      "type": "rich",
      "icon": "facebook",
      "description": "Chicago software engineering, open-source work, and business updates.",
      "group": "work",
      "order": 6,
      "enabled": true,
      "metadata": {
        "title": "Bright Builds LLC",
        "profileDescription": "Chicago software engineering, open-source work, and business updates from Bright Builds LLC.",
        "image": "https://scontent-ord5-3.xx.fbcdn.net/v/t39.30808-1/643894562_122103916773268128_8808752703618343559_n.jpg?stp=dst-jpg_s200x200_tt6&_nc_cat=107&ccb=1-7&_nc_sid=f907e8&_nc_ohc=loMHlyUSihUQ7kNvwEm9TfM&_nc_oc=Adn_L2k7TaOiRKCU65IsZcDColJR147_JDjDtLAu7BeFgTqd_3_ntE5oclTDS6Y0WCw&_nc_zt=24&_nc_ht=scontent-ord5-3.xx&_nc_gid=2UrEZISz6Y915Sw2y_Kbhw&_nc_ss=8&oh=00_AfxuxRMPjlmAwf2iCW3AYCvMShgZ5YsyrHMy81JEjkfiSg&oe=69BC7C54",
        "sourceLabel": "facebook.com"
      },
      "enrichment": {
        "enabled": false,
        "authenticatedExtractor": "facebook-auth-browser",
        "facebookPageMetrics": {
          "enabled": true,
          "pageId": "1002804269589824"
        }
      },
      "custom": {}
    },
    {
      "id": "facebook",
      "label": "Facebook",
      "url": "https://www.facebook.com/peter.ryszkiewicz",
      "type": "rich",
      "icon": "facebook",
      "description": "Personal Facebook profile",
      "group": "social",
      "order": 7,
      "enabled": true,
      "enrichment": {
        "enabled": true,
        "authenticatedExtractor": "facebook-auth-browser"
      },
      "custom": {}
    },
    {
      "id": "cluborange",
      "label": "Club Orange",
      "url": "https://app.cluborange.org/pryszkie",
      "type": "rich",
      "icon": "cluborange",
      "description": "Club Orange profile and Bitcoin-space projects",
      "group": "favorites",
      "order": 8,
      "enabled": true,
      "enrichment": {
        "enabled": true
      },
      "custom": {}
    },
    {
      "id": "cluborange-referral",
      "label": "Join Club Orange",
      "url": "https://signup.cluborange.org/co/pryszkie",
      "type": "rich",
      "icon": "cluborange",
      "description": "Club Orange signup and referral landing page",
      "group": "favorites",
      "order": 13,
      "enabled": true,
      "referral": {
        "catalogRef": {
          "familyId": "club-orange",
          "offerId": "club-orange-signup",
          "matcherId": "club-orange-signup-co-path"
        },
        "ownerBenefit": "Supports the project",
        "termsUrl": "https://www.cluborange.org/signup?referral=pryszkie"
      },
      "enrichment": {
        "enabled": true,
        "profileSemantics": "non_profile"
      },
      "custom": {}
    },
    {
      "id": "instagram",
      "label": "Instagram",
      "url": "https://www.instagram.com/peterryszkiewicz/",
      "type": "rich",
      "icon": "instagram",
      "description": "Photos and stories",
      "group": "social",
      "order": 9,
      "enabled": true,
      "enrichment": {
        "enabled": true
      },
      "custom": {}
    },
    {
      "id": "youtube",
      "label": "YouTube",
      "url": "https://www.youtube.com/@peterryszkiewicz4354",
      "type": "rich",
      "icon": "youtube",
      "description": "Videos and channel updates",
      "group": "social",
      "order": 10,
      "enabled": true,
      "enrichment": {
        "enabled": true
      },
      "custom": {}
    },
    {
      "id": "rumble",
      "label": "Rumble",
      "url": "https://rumble.com/user/taxationwithoutrepresentation",
      "type": "rich",
      "icon": "rumble",
      "description": "Rumble videos and channel updates",
      "group": "social",
      "order": 14,
      "enabled": true,
      "enrichment": {
        "enabled": true
      },
      "custom": {}
    },
    {
      "id": "medium",
      "label": "Medium",
      "url": "https://medium.com/@peterryszkiewicz",
      "type": "rich",
      "icon": "medium",
      "description": "Articles and blog posts",
      "group": "content",
      "order": 11,
      "enabled": true,
      "enrichment": {
        "enabled": true
      },
      "custom": {}
    },
    {
      "id": "spotify-podcast",
      "label": "Peter Ryszkiewicz Podcast",
      "url": "https://open.spotify.com/show/35MZ1bOgHnHnxjCwVyZcnX",
      "type": "rich",
      "icon": "spotify",
      "description": "Podcast episodes and show updates",
      "group": "content",
      "order": 15,
      "enabled": true,
      "enrichment": {
        "enabled": true
      },
      "custom": {}
    },
    {
      "id": "substack",
      "label": "Substack",
      "url": "https://peter.ryszkiewicz.us/",
      "type": "rich",
      "icon": "substack",
      "description": "Newsletter and long-form writing",
      "group": "favorites",
      "order": 12,
      "enabled": true,
      "enrichment": {
        "enabled": true
      },
      "metadata": {
        "handle": "peterryszkiewicz"
      },
      "custom": {}
    },
    {
      "id": "lemonade-referral",
      "label": "Lemonade Referral",
      "url": "https://lemonade.com/r/peterryszkiewicz",
      "type": "rich",
      "icon": "lemonade",
      "description": "Use my Lemonade referral link to start a Lemonade signup.",
      "group": "support",
      "enabled": true,
      "metadata": {
        "title": "Lemonade Referral",
        "descriptionSource": "manual"
      },
      "referral": {
        "catalogRef": {
          "familyId": "lemonade",
          "offerId": "lemonade-referral",
          "matcherId": "lemonade-referral-short-path"
        },
        "ownerBenefit": "Referrer may receive a $10 gift card for each qualified signup."
      },
      "enrichment": {
        "enabled": true
      },
      "custom": {}
    },
    {
      "id": "cluborange-lightning-tips",
      "label": "Club Orange Tips",
      "type": "payment",
      "icon": "cluborange",
      "description": "Tip me over Lightning via Club Orange",
      "group": "support",
      "enabled": true,
      "payment": {
        "primaryRailId": "lightning",
        "rails": [
          {
            "id": "lightning",
            "rail": "lightning",
            "label": "Lightning",
            "address": "peterryszkiewicz@cluborange.org",
            "qr": {
              "badge": {
                "mode": "auto"
              }
            }
          }
        ]
      },
      "custom": {}
    },
    {
      "id": "strike-lightning-tips",
      "label": "Strike Tips",
      "type": "payment",
      "icon": "strike",
      "description": "Tip me over Lightning via Strike",
      "group": "support",
      "enabled": true,
      "payment": {
        "primaryRailId": "lightning",
        "rails": [
          {
            "id": "lightning",
            "rail": "lightning",
            "label": "Strike Lightning",
            "address": "pryszkie@strike.me",
            "qr": {
              "badge": {
                "mode": "auto"
              }
            }
          }
        ]
      },
      "custom": {}
    }
  ],
  "groups": [
    {
      "id": "favorites",
      "label": "Favorites",
      "order": 1
    },
    {
      "id": "social",
      "label": "Social",
      "order": 2
    },
    {
      "id": "work",
      "label": "Work",
      "order": 3
    },
    {
      "id": "content",
      "label": "Content",
      "order": 4
    }
  ],
  "order": [
    "cluborange",
    "cluborange-referral",
    "primal",
    "github",
    "substack",
    "x",
    "linkedin",
    "openlinks-home",
    "bright-builds-facebook",
    "facebook",
    "instagram",
    "youtube",
    "medium",
    "spotify-podcast",
    "lemonade-referral",
    "cluborange-lightning-tips",
    "strike-lightning-tips"
  ],
  "custom": {}
}
